Text,Score
live florida summer time great also dehydrate learn friends internet information good coconut water replenish body need gatorade fan need find something like try coconut water read zico best say would search find chocolate coconut water try addict absolutely delicious great chocolate taste real chocolate taste sweet great pick chocolate need good regular coconut water chocolate treat,1
receive two case petite cusine amazon com earlier week figure would easy product review could possibly go wrong cat food cat eat food seem simple enough well problem cat well know eat anything refuse touch stuff rest review would think sort feline version steak lobster cat refuse play along though guess understand cat keep star puzzle look face ordinary cat food least batch receive even open strike fact seem liquid inside solid sure enough upon open find content consist lot mean lot water consistency soup ordinary cat food human food able eat fork would need spoon maybe even straw seem case varieties test cat cat refuse eat many flavor food put front sick seem quite healthy appetite regular dry food wish could come even single positive thing say petite cusine nice look box,0
notice nobody review product yet think put bonus goodie receive small box eight piece proflowers order recognize photo think candy quite good perhaps par godiva w russell stover fresh flavor pretty traditional semi sweet raspberry truffle milk chocolate caramel peanut butter shell aspen creme buttery assortment come brown box yellow ribbon contain photo guide content definite treat,1
really like organic fair trade water process decaf coffee ask much frankly bite leary type decaf use chemicals decaffeination process coffee taste fine medium roast,1
make new york package reclosable great taste,1
consider homemade quite delicious please flavor cheese extremely tasty enough broccoli taste bud recognize follow directions package ingredients cook evenly shall purchase product,1
wow thrill coffee receive sample barista prima k cup fell love taste like rich dark coffee get coffeehouse go onto amazon purchase box discover least per cup justify spend per k cup usually drink several cup coffee morning search extra dark coffee find significantly less coffee perfect rich dark flavorful bitter smooth delicious like dark roast french italian etc k cup machine coffee,1
dog favorite treat develop vomit diarrhea vet strongly suggest reconsider treat quote tie serious health problems ask ones make china say yes say take chance throw last full bag garbage please take chance pup,0
things good mortal word word caution see candy store area buy direct ship cost take breath away,1
wife decaf drinker family brand sampler set receive keurig wife love normally drink like decaf coffee pretty good classify donut shop coffee style medium roast definite decaf aftertaste turn decaf coffee although goto coffee bold organic jetfuel wake call black tiger drink want coffee buzz later night write earlier wife drink first choice,1
bad thing review anyone try san j sesame brown rice crackers wonder like try taste test eat crunchmaster like best eat san j like best san j somewhat intense flavor taste like soy sauce stronger soy sauce definitely denser texturecrunchmasters light airy crispier also satisfy also yummy like purity san j ingredients better sesame brown rice rice flour san j tamari soy sauce sweet potato starch crunchmaster good seed grain latter fiber wish safflower oil maltodextrin tho find san j oz size much expensive yes really get crunchmaster half amazon price costco like live middle city car amazon place buy box free ship beat drive spend money gas anyway,1
actually really love jack link original beef steak nuggets however pack receive seem old nearly good ones purchase gas station make wonder would tough much drier expect say order mail fresher would rat love really,1
always risk buy food bulk fresh delicious great deal,1
contemplate get year limted offer coffee way expensive almost break hear great review finally become available normal price one worst flavor coffees problem like extremly bold strong coffee also normally flavor coffees stuff weak hint coconut get definitely buy stick old faithful midnight magic,0
taste awesome real natural flavor bring work everyone ask get,1
best chip find lot place easiest way go come fast great shape pick bag,1
terrific tea love drink almost daily since buy certainly buy future,1
quick minute oatmeal wait worth opinion oatmeal mean enjoy never go back box variety texture appeal taste slight hint nutty flavor shame try many years ago know miss,1
wasa bread would unconditional rat except breakage one expect surface spread toppings package half whole crackers half crumb reduce satisfaction significantly,1
someone give dog natural organic food treat regular thing always will try something new swear dog could tell crinkle package feet entire time open bag hand grab go devour guess success quite bite expensive daily treat buy great treat,1
highly recommend coffee brand cafe pura vida enjoy high quality pure coffee best interest enjoy try home office,1
stash blend delicious green tea herbs flavor delicious need sweeten little,1
hubby use buy large bottle cream become ill checkedout amazon com find product make coffee add sugar andthis cream use add milk coffee cool immediately wouldnot hesitate recommend wonderful convenient item,1
use rimmer christmas cocktails make look sparkle jewel top drink always winner,1
percent candy brand still sell store today could pay dollars grocery store probably get time much candy money,0
avid tea drinker drink wide variety teas huge fan hibiscus tea want try mix everything sound wonderful try rise hip hibiscus mix jive well hibiscus tea bitter already nornally mind rise hips nothing taste make bitter less enjoyable satisfy purchase better buy loose leaf hibiscus tea brew alone want mention issue seller product tasty comfort like many good quality teas reccomend buy,0
fan jerky years buy taste nearly gag gallopin pepper flavor wild ride jerky spicy mushy lack expect standard beef jerky texture like eat imagine sour ish cardboard save money pass one,0
super fabulous actually crave average break food ramen flavor spice terrific spicy actually enjoy flavor dry veggies great want authentic crack egg still cook husband two tour korea add cheese find kinda gross koreans never korea eat ramen make feel like least taste,1
every one children love toaster pastries hard accomplish house originally purchase local health food pickiest eater beg obviously go continuously pay much box toaster pastries go hunt best price purchase subscribe save amazon get free ship mean even go store deal go try wildberry acai next let know think,1
come site look c e dog chew vet recommend dog notice also make cat chew three finicky cat skeptical like chew decide try fish flavor ones anyway well cat go crazy fact hide bag rip look notice improvement oldest cat breath,1
try type hospital give us give fussiness gas formula give painful constipation put cry hop new formula clear soon get breastmilk supply issue supplement,0
follow purchae theraputic honey larger quantity require response delivery good knowledge enter genuine debate product taste fine seem healthful properties buy,1
two cat one one years old indoor cat excellent health saw negative review talk vet also ask number veterinary professionals fee cat answer thing science diet sure see stories one person cat issue even true case millions science fact base someone experience point love cat concern health trust people actually medical degrees experience wide range animals caution fall hype scare tactic recommend unproven untested food fad diet pet listen listen negative review ask vet recommend follow instructions guess end buy science diet anyhow,1
love k cup carousel help neaten supply look good sit counter saw others one definitely hold lot k cup look good ask,1
nice bold flavorful coffee like mine ice tend water flavor coffees one,1
folks believe true breakfast teas grab collar throw front door rarin go tea hold opinion rather sedate tea brew engage contemplation slowly enjoy time day include breakfast rich flavor overpower particularly robust strike right tone time day couple incidental point sure individual tea bag package effective say bigelow internal second layer protection also order large shipments available amazon must give think store extensive supply tea bag keep long term bunch fridge immediately use handy cupboard plastic freezer bag seem work ok keep fresh,1
hesitant price let deter cherries flavor explosion want miss fabulous,1
little drop amaze first sign scratchy throat first things reach taste wonderful smooth honey inside love,1
able find coffee decaf local store happy find amazon reasonable price quick easy make taste great wish could find expiration date can purchase store date bottom,1
think fish oil would great supplement cat one begin overgroom create bald patch stomach legs four cat refuse type food fish oil add try many days many ways finally switch back newer dry food think would better back old dry food obviously oil ingredients bald cat get fur back,0
great even tell sugar free everyone give love also,1
go give gift make sure box order christmas gift relative show brown paper bag staple top,0
liquid stevia find awful taste use everything coffee cocktails fabulous great way cut sugar diet still enjoy sweet stuff highly concentrate little go long way,1
applewood smoke bacon thin slice family lbs best bacon ever taste also uniform right amount fat piece vary much taste spectacular sip fast,1
wife love gum longer find locally find online happy korea right get suprise happy say get package open saw thank much thoughtful gotta love hero get something want amazon get assist help thank cub,1
search food kittehs please find new flavor also disappoint put feed time first time feed kid pick never really clean plat wait several days offer get look total disgust tail flick walk away guess order,0
dear amazon comi please inform product receive promise good shape happy purchase seller thank bensuf yahoo com,1
excellent product go well nice bologenes sauce broccoli garlic saute fresh lemon zest little pesto sauce also fine base shrimp dish like scampi special pasta egg base every day spaghetti cook minutes love one half box perfect dinner two,1
black tea decaffeinate often taste weak thin company add chicory counter problem make tea taste like bad coffee know pg tip do decaf tea bag still give decent british cuppa decaf black tea carry tea store,1
picky yr old german shepherd leave anything milkbone floor collect dust love bone amaze see crunch large bone quickly always well discipline bone arrive least go pantry tear bag open eat bone low hang head approach issue could laugh luckily month old shephard get one sister eat batch save order bone amazon,1
think make best homemade pasta ever make least children tell much fun fix enormous batch pasta together split flour type use semolina regular white unbleached flour keep price little lower however purchase bulk way cost effective way good pasta flour approximately per oz package amazon buy exact package grocery store,1
love coffee live name great monday mornings caffeine drop either nice smooth land glad buy bulk,1
bar absolutely delicious steer clear call fiber bar snack bar etc honestly taste like stale cereal completely different cereal similarities nut fruit hard stop one try disappoint,1
find mix make really good small upside cake use pineapple guess could use ever fruit like bake one round cake pan,1
know chocolate turn light brown get old top lighter shade brown old part taste right liquor inside good candy fresh,0
use caponata alessi cento paesano progresso shop rite brand marco polo first pretty good marco polo terrible taste consistency appearance substandard call parthenon foods agree refund purchase price remain jar order time pay ship spend entire cost order nothing show money except bad taste mouth wallet wallets taste go donate remain jar marco polo caponata homeless center hope nobody die result thoroughly negative experience,0
love high quality tea roll little pellets open hot water taste gunpowder green tea little stronger use try conventional green tea next time,1
remember dress little favorite summertime treat mother plate freshly slice homegrown tomatoes tas tee dress find anymore imagine delight finally find good remember still wonderful juicy tomato slice well chicken salads sandwich,1
drink coffee black think go love blend coffee delicious great bold flavor,1
buy toor dal simplybeautiful look old color grain turn black suppose yellow fresh please sell expire items,0
beekeeper would really like know certify organic honey organic honey maybe keep be nursery,0
would never purchase product better luck wilton sugar sheet instructions help could remove image without tear complete waste time money,0
chip good must ship problem chip small piece,0
first little worry would arrive stale stale taste delicious also expect lbs many red vines haha month almost still plenty leave,1
love mint since give smoke use lot kind oral pacifier good taste low calorie really get hook,1
things arrive counterparts afghanistan vendor prompt exactly want delicious barely last days definitively order get stateside probably subscribe,1
can dent even though original case make wonder repackaged food pretty stinky dog eat love cat food however cat scarf right,0
really love snack grill cheese flavor absolutely horrible please pick another flavor unless try one sure like one winner imho,0
pretty tasty dont stick teeth like fruit snack huge plus even better natural good buy sure soon box run,1
sure product really make difference supply sure taste good,1
taste really good love coconut enough balance coconut overpower help heartburn well,1
use pop popcorn taste great first coconut oil use like better oil,1
really enjoy fuji apple asian pear pouch equivalent piece fruit piece get crush majority good size piece personally like strawberry banana piece small odd taste item lose star strawberry banana pay premium compare fresh fruit worry fruit go bad recommend pack pick favorite fruit order one individually,1
big tea drinker love loose herbal organic teas rishi tea loose tea infuser basket come package three perfect home work use baskets several time everyday thoroughly please product must serious tea drinkers,1
drink tea month friend tell diabetic person since take medication lower blood sugar amaze friend give bag observe meal blood sugar go without take medication recommend co worker surprise well tea really work better take medication chemicals order tea soon start get low would recommend order online coz find oriental store price way high,1
two cat one extremely finicky even treat love,1
hash brown delicious ever eat easy fix local grocery store stop carry product order thru amazon,1
one ones actually like drink water health benefit actually drink choice buy different water one perfect clean taste smooth metallic taste aftertase great water,1
regular order subscribe save whole household love littlest year old even tastier nationally know household name brand better artificial flavor color corn syrup,1
get calorie pack helpful portion control lately try watch sodium pretzels lowest carry grocery store great product,1
order dark magic k cup box therefore box x k cup receive box company change name frequently send wrong quantity beware non amazon sellers amazon contact investigate fraud however amazon easy return process,0
cookie review may initially seem superfluous one consider case talk spin edible touchstone national biscuit company responsible products define brand identity market suit think term animal crackers oreo cookies merely mass produce kid snack candy culture icons let leave animals cardboard wheel cage remind make oreo legendary crisp chocolate cookie explode mouth like fistful gravel better america good thing subdue generous dollop stiff whip sweet vanilla like cream bind together delightful chocolate vanilla tango sugary goodness amid audible grind glass crunch may need cigarette new peanut butter creme oreo fudge creme delicious treat regrettably live oreo standard final verdict enough cookie chocolate fudge cover slightly waxy texture oh sweet satisfy taste simply overwhelm cookie layer help smooth peanut butter fill equally flavorful moist standard choco pb fix reese cup sadly creamy pb layer fudge chocolate envelope combine neuter thin chocolate crunch taste proportion texture thicken wafer half let another go nabisco also noteworthy amount crush proof package provide cookie let say ratio package cookies definitely rise nevertheless undoubtedly eat stomach ache unless well hide soon,1
chocolate name leonidas kestekidis definitely know create chocolates true chocolate connoisseur move back belgium marry true love create chocolates world adore taste chocolates taste bud also finally know true chocolate happiness whether try one cup coffee tea enjoy one daily indulgence impress chocolate unique design sample variety chocolates specific flavor stand favorites favorite creamy fill ganache buttercream come dark white milk chocolate depend selection antoinette smooth brandy flavor ganachelingoit lait absolutely delicious vanilla flavor fresh butter cream fill time definitely stop taste chocolate ever love coffee may one delicious milk dark chocolate chocolates ever make fill special coffee cream hint caramel order entire box sometime future merveilleux milk dark chocolate fill coffee ganache europe dark milk chocolate fill rum fill ganache milk dark chocolate pure ganache tosca milk chocolate special ganache antoinette delicate caramel hint milk chocolate coat mingle nicely vanilla fill eve milk chocolate banana fill alexandre le grand milk dark chocolate caramel cream also recommend wish also try napolitains suggest pound sampler ballotin six varieties may also want look new palet deeply delicious strong bitter chocolate fill ganache center make butter cream chocolate outer coat masterpiece gold decorations leonidas store sales locations worldwide offer varieties fresh chocolates chocolates air freight weekly brussels always find quality superior chocolates arrive fast fresh purchase belgium say first taste belgium carefully package famous gold box signature seasonal wrap ribbon box place protective styrofoam containers protect chocolates ship expedite ship recommend may early september want introduce friends family tothe leonidas chocolates perfect way orderthem give holiday rebecca review,1
love oil nice color taste great please price quality definitely buy,1
certain fragrances put sinuses spin minute nose invite happen moment smell shampoo happen sensitive odors doubt want clear scalp know chemical bother synthetic throb smell become less common fruiter scent enter market hard describe years ago clairol color conditioner pantene sniff latter market today like clairol longer contain odor fair clear scalp extreme overachiever come picky nose encounter particular product end pop sinus pill couple aspirin get dab shampoo hand rinse quickly odor cling hours faint twinge induce get hand near face consequently dare use conditioner hair give one star husband however give four star knock one love fragrance actively dislike prefer coconutty scent love hair see feel hair feel silky thicker shampoo conditioner give body look good odor trace scent leave tonight sinuses bother sniff hair shampoo definitely nice things hair suggest test sniff purchase,1
great taste coffee like brew strong full flavor definetly fit bill consistently good cup coffee every time,1
drink taster choice instant flavor coffee years love mix hazelnut vanilla together create fuller body gourmet coffee like blend initially products available large canisters five years ago canisters flavor replace single serve straw last year try find flavor coffee market become futile find price stick box club card seriously go line product search desperately need java find wonderful link today happy camper coffee arrive days early pack lovingly bubble wrap order fine crystal unit cost per box come approx order soon finish write review thank soooooo much,1
soooo good low fat low salt diet ultra yummy fruit candy right send big box good friend heart surgery fit nicely dietary restrictions good,1
shipment quick half can shipment dent one cat like introduce several time like,0
sweetleaf flavor products people want something really sweet barest whiff flavor probably even able tell one look product half sweetness half flavor urge save money look another solution,0
huge fan amazon order time least weekly first time ever write review strongly feel big walnut lover things absolutely gross open first eat first one think go throw spit wash mouth think rotten poison something open two can way absolutely disgust taste stale rotten time throw six can trash even give squirrels would look elsewhere,0
easy make nutritious taste great ask wait get hand,1
big fan green mountain coffee blueberry flavor one favorites k cup great taste know love fresh grind version blueberry flavor way dominate give great sweet aroma excellent coffee flavor hint blueberry aftertaste unsure flavor would suggest try coffee shop cafe buy entire k cup pack try something different know love flavor great buy,1
sign first find flavor years back think stress food notice longer stock grocery store shelve wal mart target etc talk let course get imagine girlie glee little quick search discover could find online could deliver door could hoard much want oh little evil mini shoulder please please various flavor combinations cannot describe experience joy jelly bellly,1
really good weight watchers tablespoons point vs point regular peanut butter saw dr oz show order day,1
sugar butter egg three staple almost every kitchen know three ingredients could combine way produce jules destrooper wonderful butter crisp actually learn butter crisp wife aunt make year christmas always give us lot always eat way love treat become highlight christmas day walk local store happen upon jules destrooper butter crisp immediately grab box quite good homemade ones wife aunt come extremely close second place homemade always beat store buy brand opinion jules destrooper get year december roll around enjoy lightly sweeten terribly addictive treat highly recommend jules destrooper butter crisp great snack time year perfect compliment ice cream coffee highly recommend,1
son call bulbosa medusa plant remind us first unpackaged strike plant bright green ting purple around base come beautiful condition one even red color leave hint might go bloom definite eye catcher,1
love flavor coffee drink black sugar use add sugar half half fine since switch black coffee ones previously love discover great without fix like black would pass one wish barnie coffee would sell k cup love southern pecan yummmmmmmmmmmm si bad wonderful,1
lipton new packets ice green tea honey blackberry pomegranate delicious refresh light taste plus calories per packet obviously similar probably direct competition crystal light go packets naturally lipton offer tea flavor instructions say add one full packet oz water use twice water recommend one packet still flavorable super sweet go use glass water small bottle water recommend try half packet less start honey granules sugar honey dissolve sweeten water package tout aspartame equal like crystal light sucralose list ingredient another artificial sweetener importantly though new lipton packets like crystal light packets give water little boost flavor case green tea flavonoids try eliminate sodas diet tire drink water try little packets still drink water flavor boost make feel like drink water,1
pointer mix sensitive stomach also sensitivity chicken work really well solid stool noticeable gas small dog havanese also well strong stomach anyway seem love taste add bonus piece small helpful little dog,1
